[
  {
    "letter": "A",
    "word": "Acoustic Guitar",
    "mode": "letter-name",
    "familiarity_tier": "B",
    "letter_name_sound_cue": "strong-initial",
    "visual_confusability": "low",
    "phonological_name_confusability": "medium",
    "sequence_dependency_risk": "low",
    "syllable_count": 5,
    "stress_pattern": "S-w-w-w-w",
    "pronunciation_note": "Working stress pattern; confirm naturally during L0 read-aloud and L1 audio review.",
    "prosodic_motif_variant": "orchestra-cue-4syll",
    "round1_objective": "lexical-semantic",
    "round2_objective": "retrieval-action",
    "retrieval_cue": "A",
    "retrieval_gap_plan": "one to two predictable beats of retrieval space before target confirmation",
    "congruent_action": "point to the matching picture",
    "rhyme_family": "say-way",
    "visual_reveal_rule": "round1=line-start; round2=target-word",
    "contrast_notes": null,
    "risk_flags": [
      "prosody-review"
    ]
  },
  {
    "letter": "B",
    "word": "Bell",
    "mode": "letter-name",
    "familiarity_tier": "A",
    "letter_name_sound_cue": "strong-initial",
    "visual_confusability": "high",
    "phonological_name_confusability": "high",
    "sequence_dependency_risk": "low",
    "syllable_count": 1,
    "stress_pattern": "S",
    "pronunciation_note": null,
    "prosodic_motif_variant": "orchestra-cue-1syll",
    "round1_objective": "lexical-semantic",
    "round2_objective": "retrieval-action",
    "retrieval_cue": "B",
    "retrieval_gap_plan": "one to two predictable beats of retrieval space before target confirmation",
    "congruent_action": "point to the matching picture",
    "rhyme_family": "blue-you",
    "visual_reveal_rule": "round1=line-start; round2=target-word",
    "contrast_notes": "Isolate the capital letter before showing confusable competitors.",
    "risk_flags": []
  },
  {
    "letter": "C",
    "word": "Clarinet",
    "mode": "letter-name",
    "familiarity_tier": "A",
    "letter_name_sound_cue": "weak-or-misleading",
    "visual_confusability": "medium",
    "phonological_name_confusability": "high",
    "sequence_dependency_risk": "low",
    "syllable_count": 3,
    "stress_pattern": "S-w-w",
    "pronunciation_note": "Working stress pattern; confirm naturally during L0 read-aloud and L1 audio review.",
    "prosodic_motif_variant": "orchestra-cue-3syll",
    "round1_objective": "lexical-semantic",
    "round2_objective": "retrieval-action",
    "retrieval_cue": "C",
    "retrieval_gap_plan": "one to two predictable beats of retrieval space before target confirmation",
    "congruent_action": "point to the matching picture",
    "rhyme_family": "trail-tell",
    "visual_reveal_rule": "round1=line-start; round2=target-word",
    "contrast_notes": "Isolate the capital letter before showing confusable competitors.",
    "risk_flags": [
      "prosody-review"
    ]
  },
  {
    "letter": "D",
    "word": "Drum",
    "mode": "letter-name",
    "familiarity_tier": "A",
    "letter_name_sound_cue": "strong-initial",
    "visual_confusability": "high",
    "phonological_name_confusability": "high",
    "sequence_dependency_risk": "low",
    "syllable_count": 1,
    "stress_pattern": "S",
    "pronunciation_note": null,
    "prosodic_motif_variant": "orchestra-cue-1syll",
    "round1_objective": "lexical-semantic",
    "round2_objective": "retrieval-action",
    "retrieval_cue": "D",
    "retrieval_gap_plan": "one to two predictable beats of retrieval space before target confirmation",
    "congruent_action": "point to the matching picture",
    "rhyme_family": "go-show",
    "visual_reveal_rule": "round1=line-start; round2=target-word",
    "contrast_notes": "Isolate the capital letter before showing confusable competitors.",
    "risk_flags": []
  },
  {
    "letter": "E",
    "word": "Euphonium",
    "mode": "letter-name",
    "familiarity_tier": "A",
    "letter_name_sound_cue": "strong-initial",
    "visual_confusability": "low",
    "phonological_name_confusability": "high",
    "sequence_dependency_risk": "medium",
    "syllable_count": 3,
    "stress_pattern": "S-w-w",
    "pronunciation_note": "Working stress pattern; confirm naturally during L0 read-aloud and L1 audio review.",
    "prosodic_motif_variant": "orchestra-cue-3syll",
    "round1_objective": "lexical-semantic",
    "round2_objective": "retrieval-action",
    "retrieval_cue": "E",
    "retrieval_gap_plan": "one to two predictable beats of retrieval space before target confirmation",
    "congruent_action": "point to the matching picture",
    "rhyme_family": "bright-right",
    "visual_reveal_rule": "round1=line-start; round2=target-word",
    "contrast_notes": null,
    "risk_flags": [
      "prosody-review"
    ]
  },
  {
    "letter": "F",
    "word": "Flute",
    "mode": "letter-name",
    "familiarity_tier": "A",
    "letter_name_sound_cue": "embedded-final",
    "visual_confusability": "low",
    "phonological_name_confusability": "low",
    "sequence_dependency_risk": "medium",
    "syllable_count": 1,
    "stress_pattern": "S",
    "pronunciation_note": null,
    "prosodic_motif_variant": "orchestra-cue-1syll",
    "round1_objective": "lexical-semantic",
    "round2_objective": "retrieval-action",
    "retrieval_cue": "F",
    "retrieval_gap_plan": "one to two predictable beats of retrieval space before target confirmation",
    "congruent_action": "point to the matching picture",
    "rhyme_family": "near-clear",
    "visual_reveal_rule": "round1=line-start; round2=target-word",
    "contrast_notes": null,
    "risk_flags": []
  },
  {
    "letter": "G",
    "word": "Gong",
    "mode": "letter-name",
    "familiarity_tier": "A",
    "letter_name_sound_cue": "strong-initial",
    "visual_confusability": "medium",
    "phonological_name_confusability": "high",
    "sequence_dependency_risk": "medium",
    "syllable_count": 1,
    "stress_pattern": "S",
    "pronunciation_note": null,
    "prosodic_motif_variant": "orchestra-cue-1syll",
    "round1_objective": "lexical-semantic",
    "round2_objective": "retrieval-action",
    "retrieval_cue": "G",
    "retrieval_gap_plan": "one to two predictable beats of retrieval space before target confirmation",
    "congruent_action": "point to the matching picture",
    "rhyme_family": "see-me",
    "visual_reveal_rule": "round1=line-start; round2=target-word",
    "contrast_notes": "Isolate the capital letter before showing confusable competitors.",
    "risk_flags": []
  },
  {
    "letter": "H",
    "word": "Harp",
    "mode": "letter-name",
    "familiarity_tier": "A",
    "letter_name_sound_cue": "strong-initial",
    "visual_confusability": "low",
    "phonological_name_confusability": "low",
    "sequence_dependency_risk": "medium",
    "syllable_count": 1,
    "stress_pattern": "S",
    "pronunciation_note": null,
    "prosodic_motif_variant": "orchestra-cue-1syll",
    "round1_objective": "lexical-semantic",
    "round2_objective": "retrieval-action",
    "retrieval_cue": "H",
    "retrieval_gap_plan": "one to two predictable beats of retrieval space before target confirmation",
    "congruent_action": "point to the matching picture",
    "rhyme_family": "say-way",
    "visual_reveal_rule": "round1=line-start; round2=target-word",
    "contrast_notes": null,
    "risk_flags": []
  },
  {
    "letter": "I",
    "word": "Irish Whistle",
    "mode": "letter-name",
    "familiarity_tier": "B",
    "letter_name_sound_cue": "strong-initial",
    "visual_confusability": "low",
    "phonological_name_confusability": "medium",
    "sequence_dependency_risk": "medium",
    "syllable_count": 4,
    "stress_pattern": "S-w-w-w",
    "pronunciation_note": "Working stress pattern; confirm naturally during L0 read-aloud and L1 audio review.",
    "prosodic_motif_variant": "orchestra-cue-4syll",
    "round1_objective": "lexical-semantic",
    "round2_objective": "retrieval-action",
    "retrieval_cue": "I",
    "retrieval_gap_plan": "one to two predictable beats of retrieval space before target confirmation",
    "congruent_action": "grow hands upward like a plant",
    "rhyme_family": "blue-you",
    "visual_reveal_rule": "round1=line-start; round2=target-word",
    "contrast_notes": null,
    "risk_flags": [
      "prosody-review"
    ]
  },
  {
    "letter": "J",
    "word": "Jingle Bells",
    "mode": "letter-name",
    "familiarity_tier": "B",
    "letter_name_sound_cue": "strong-initial",
    "visual_confusability": "low",
    "phonological_name_confusability": "medium",
    "sequence_dependency_risk": "medium",
    "syllable_count": 3,
    "stress_pattern": "S-w-w",
    "pronunciation_note": "Working stress pattern; confirm naturally during L0 read-aloud and L1 audio review.",
    "prosodic_motif_variant": "orchestra-cue-3syll",
    "round1_objective": "lexical-semantic",
    "round2_objective": "retrieval-action",
    "retrieval_cue": "J",
    "retrieval_gap_plan": "one to two predictable beats of retrieval space before target confirmation",
    "congruent_action": "point to the matching picture",
    "rhyme_family": "trail-tell",
    "visual_reveal_rule": "round1=line-start; round2=target-word",
    "contrast_notes": null,
    "risk_flags": [
      "prosody-review"
    ]
  },
  {
    "letter": "K",
    "word": "Kazoo",
    "mode": "letter-name",
    "familiarity_tier": "A",
    "letter_name_sound_cue": "strong-initial",
    "visual_confusability": "low",
    "phonological_name_confusability": "medium",
    "sequence_dependency_risk": "medium",
    "syllable_count": 2,
    "stress_pattern": "S-w",
    "pronunciation_note": "Working stress pattern; confirm naturally during L0 read-aloud and L1 audio review.",
    "prosodic_motif_variant": "orchestra-cue-2syll",
    "round1_objective": "lexical-semantic",
    "round2_objective": "retrieval-action",
    "retrieval_cue": "K",
    "retrieval_gap_plan": "one to two predictable beats of retrieval space before target confirmation",
    "congruent_action": "point to the matching picture",